2026-01-20 10:16:09 - habit - INFO - [log_utils.py:127] - Log file initialized: F:\work\habit_project\demo_data\ml_data\radiomics\processing.log
2026-01-20 10:16:09 - habit.cli.ml - INFO - [cmd_ml.py:53] - Starting machine learning training with config: ./demo_data/config_machine_learning_radiomics.yaml
2026-01-20 10:16:09 - habit.ml_standard - INFO - [machine_learning.py:26] - Starting Standard ML Pipeline with Pipeline support...
2026-01-20 10:16:09 - habit.ml_standard - INFO - [base_workflow.py:39] - Loading and preparing data...
2026-01-20 10:16:09 - habit.ml_standard - INFO - [data_manager.py:30] - Loading data from 1 files
2026-01-20 10:16:09 - habit.ml_standard - INFO - [data_manager.py:46] - Reading F:\work\habit_project\demo_data\ml_data\breast_cancer_dataset.csv (Subject: subjID, Label: label)
2026-01-20 10:16:09 - habit.ml_standard - INFO - [data_manager.py:94] - Data loaded: (569, 13)
2026-01-20 10:16:09 - habit.ml_standard - INFO - [data_manager.py:146] - Split results: Train=300, Test=269
2026-01-20 10:16:09 - habit.ml_standard - INFO - [machine_learning.py:39] - Training Model: LogisticRegression
2026-01-20 10:16:09 - habit.ml.feature_selection - INFO - [pipeline_utils.py:64] - ================================================================================
2026-01-20 10:16:09 - habit.ml.feature_selection - INFO - [pipeline_utils.py:65] - Feature Selection Stage: Before Normalization
2026-01-20 10:16:09 - habit.ml.feature_selection - INFO - [pipeline_utils.py:66] - ================================================================================
2026-01-20 10:16:09 - habit.ml.feature_selection - INFO - [pipeline_utils.py:67] - Initial number of features: 12
2026-01-20 10:16:09 - habit.ml.feature_selection - INFO - [pipeline_utils.py:68] - Initial features: ['compactness error', 'concavity error', 'concave points error', 'symmetry error', 'fractal dimension error', 'worst radius', 'worst texture', 'worst perimeter', 'worst area', 'worst smoothness', 'worst compactness', 'worst fractal dimension']
2026-01-20 10:16:09 - habit.ml.feature_selection - INFO - [pipeline_utils.py:69] - --------------------------------------------------------------------------------
2026-01-20 10:16:09 - habit.ml.feature_selection - INFO - [pipeline_utils.py:93] - 
Step 1: Applying 'variance' feature selection
2026-01-20 10:16:09 - habit.ml.feature_selection - INFO - [pipeline_utils.py:94] -   Parameters: {'before_z_score': True, 'threshold': 0.2, 'plot_variances': True}
2026-01-20 10:16:09 - habit.ml.feature_selection - INFO - [pipeline_utils.py:95] -   Features before this step: 12
2026-01-20 10:16:10 - habit.ml.feature_selection - INFO - [pipeline_utils.py:111] -   Features after this step: 4
2026-01-20 10:16:10 - habit.ml.feature_selection - INFO - [pipeline_utils.py:112] -   Number of features removed: 8
2026-01-20 10:16:10 - habit.ml.feature_selection - INFO - [pipeline_utils.py:115] -   Removed features: ['compactness error', 'concavity error', 'concave points error', 'symmetry error', 'fractal dimension error', 'worst smoothness', 'worst compactness', 'worst fractal dimension']
2026-01-20 10:16:10 - habit.ml.feature_selection - INFO - [pipeline_utils.py:119] -   Retained features: ['worst radius', 'worst texture', 'worst perimeter', 'worst area']
2026-01-20 10:16:10 - habit.ml.feature_selection - INFO - [pipeline_utils.py:120] - --------------------------------------------------------------------------------
2026-01-20 10:16:10 - habit.ml.feature_selection - INFO - [pipeline_utils.py:123] - 
Feature Selection Summary (Before Normalization):
2026-01-20 10:16:10 - habit.ml.feature_selection - INFO - [pipeline_utils.py:124] -   Total steps executed: 1
2026-01-20 10:16:10 - habit.ml.feature_selection - INFO - [pipeline_utils.py:125] -   Initial features: 12
2026-01-20 10:16:10 - habit.ml.feature_selection - INFO - [pipeline_utils.py:126] -   Final features: 4
2026-01-20 10:16:10 - habit.ml.feature_selection - INFO - [pipeline_utils.py:127] -   Total features removed: 8
2026-01-20 10:16:10 - habit.ml.feature_selection - INFO - [pipeline_utils.py:128] -   Retention rate: 33.33%
2026-01-20 10:16:10 - habit.ml.feature_selection - INFO - [pipeline_utils.py:129] -   Final selected features: ['worst radius', 'worst texture', 'worst perimeter', 'worst area']
2026-01-20 10:16:10 - habit.ml.feature_selection - INFO - [pipeline_utils.py:130] - ================================================================================
2026-01-20 10:16:10 - habit.ml.feature_selection - INFO - [pipeline_utils.py:64] - ================================================================================
2026-01-20 10:16:10 - habit.ml.feature_selection - INFO - [pipeline_utils.py:65] - Feature Selection Stage: After Normalization
2026-01-20 10:16:10 - habit.ml.feature_selection - INFO - [pipeline_utils.py:66] - ================================================================================
2026-01-20 10:16:10 - habit.ml.feature_selection - INFO - [pipeline_utils.py:67] - Initial number of features: 4
2026-01-20 10:16:10 - habit.ml.feature_selection - INFO - [pipeline_utils.py:68] - Initial features: ['worst radius', 'worst texture', 'worst perimeter', 'worst area']
2026-01-20 10:16:10 - habit.ml.feature_selection - INFO - [pipeline_utils.py:69] - --------------------------------------------------------------------------------
2026-01-20 10:16:10 - habit.ml.feature_selection - INFO - [pipeline_utils.py:93] - 
Step 1: Applying 'icc' feature selection
2026-01-20 10:16:10 - habit.ml.feature_selection - INFO - [pipeline_utils.py:94] -   Parameters: {'icc_results': 'F:\\work\\habit_project\\demo_data\\ml_data\\icc_radiomics.json', 'keys': ['breast_cancer_dataset_vs_breast_cancer_dataset_retest_simulated'], 'metric': 'ICC2', 'threshold': 0.8}
2026-01-20 10:16:10 - habit.ml.feature_selection - INFO - [pipeline_utils.py:95] -   Features before this step: 4
2026-01-20 10:16:10 - habit.ml.feature_selection - INFO - [pipeline_utils.py:111] -   Features after this step: 4
2026-01-20 10:16:10 - habit.ml.feature_selection - INFO - [pipeline_utils.py:112] -   Number of features removed: 0
2026-01-20 10:16:10 - habit.ml.feature_selection - INFO - [pipeline_utils.py:117] -   No features removed in this step
2026-01-20 10:16:10 - habit.ml.feature_selection - INFO - [pipeline_utils.py:119] -   Retained features: ['worst radius', 'worst texture', 'worst perimeter', 'worst area']
2026-01-20 10:16:10 - habit.ml.feature_selection - INFO - [pipeline_utils.py:120] - --------------------------------------------------------------------------------
2026-01-20 10:16:10 - habit.ml.feature_selection - INFO - [pipeline_utils.py:93] - 
Step 2: Applying 'vif' feature selection
2026-01-20 10:16:10 - habit.ml.feature_selection - INFO - [pipeline_utils.py:94] -   Parameters: {'max_vif': 10, 'visualize': False, 'before_z_score': False}
2026-01-20 10:16:10 - habit.ml.feature_selection - INFO - [pipeline_utils.py:95] -   Features before this step: 4
2026-01-20 10:16:10 - habit.ml.feature_selection - INFO - [pipeline_utils.py:111] -   Features after this step: 2
2026-01-20 10:16:10 - habit.ml.feature_selection - INFO - [pipeline_utils.py:112] -   Number of features removed: 2
2026-01-20 10:16:10 - habit.ml.feature_selection - INFO - [pipeline_utils.py:115] -   Removed features: ['worst radius', 'worst perimeter']
2026-01-20 10:16:10 - habit.ml.feature_selection - INFO - [pipeline_utils.py:119] -   Retained features: ['worst texture', 'worst area']
2026-01-20 10:16:10 - habit.ml.feature_selection - INFO - [pipeline_utils.py:120] - --------------------------------------------------------------------------------
2026-01-20 10:16:10 - habit.ml.feature_selection - INFO - [pipeline_utils.py:93] - 
Step 3: Applying 'correlation' feature selection
2026-01-20 10:16:10 - habit.ml.feature_selection - INFO - [pipeline_utils.py:94] -   Parameters: {'threshold': 0.8, 'method': 'spearman', 'visualize': False, 'before_z_score': False}
2026-01-20 10:16:10 - habit.ml.feature_selection - INFO - [pipeline_utils.py:95] -   Features before this step: 2
2026-01-20 10:16:10 - habit.ml.feature_selection - INFO - [pipeline_utils.py:111] -   Features after this step: 2
2026-01-20 10:16:10 - habit.ml.feature_selection - INFO - [pipeline_utils.py:112] -   Number of features removed: 0
2026-01-20 10:16:10 - habit.ml.feature_selection - INFO - [pipeline_utils.py:117] -   No features removed in this step
2026-01-20 10:16:10 - habit.ml.feature_selection - INFO - [pipeline_utils.py:119] -   Retained features: ['worst texture', 'worst area']
2026-01-20 10:16:10 - habit.ml.feature_selection - INFO - [pipeline_utils.py:120] - --------------------------------------------------------------------------------
2026-01-20 10:16:10 - habit.ml.feature_selection - INFO - [pipeline_utils.py:123] - 
Feature Selection Summary (After Normalization):
2026-01-20 10:16:10 - habit.ml.feature_selection - INFO - [pipeline_utils.py:124] -   Total steps executed: 3
2026-01-20 10:16:10 - habit.ml.feature_selection - INFO - [pipeline_utils.py:125] -   Initial features: 4
2026-01-20 10:16:10 - habit.ml.feature_selection - INFO - [pipeline_utils.py:126] -   Final features: 2
2026-01-20 10:16:10 - habit.ml.feature_selection - INFO - [pipeline_utils.py:127] -   Total features removed: 2
2026-01-20 10:16:10 - habit.ml.feature_selection - INFO - [pipeline_utils.py:128] -   Retention rate: 50.00%
2026-01-20 10:16:10 - habit.ml.feature_selection - INFO - [pipeline_utils.py:129] -   Final selected features: ['worst texture', 'worst area']
2026-01-20 10:16:10 - habit.ml.feature_selection - INFO - [pipeline_utils.py:130] - ================================================================================
2026-01-20 10:16:10 - habit.ml_standard - INFO - [machine_learning.py:195] - Prediction results saved to CSV files.
2026-01-20 10:16:10 - habit.ml_standard - INFO - [machine_learning.py:135] - Generating plots for training set...
2026-01-20 10:16:10 - habit.evaluation.plot_manager - INFO - [plot_manager.py:38] - Visualization is disabled in config.
2026-01-20 10:16:10 - habit.ml_standard - INFO - [machine_learning.py:144] - Generating plots for test set...
2026-01-20 10:16:10 - habit.evaluation.plot_manager - INFO - [plot_manager.py:38] - Visualization is disabled in config.
2026-01-20 10:16:10 - habit.ml_standard - INFO - [machine_learning.py:152] - Standard ML workflow completed. Models saved to F:\work\habit_project\demo_data\ml_data\radiomics
